{"checked_at_utc":"2026-07-23T18:03:02Z","checks":[{"code":"P1.POLICY","detail":"policy valid","passed":true},{"code":"P1.MANIFEST","detail":"all manifested artifacts verified","passed":true},{"code":"P1.BASELINE_ROLE","detail":"expected exactly one baseline-frontier artifact; found 1","passed":true},{"code":"P1.E1_PARITY_ROLE","detail":"expected exactly one e1-parity-report artifact; found 1","passed":true},{"code":"P1.E1_FRONTIER_ROLE","detail":"expected exactly one e1-frontier-payload artifact; found 1","passed":true},{"code":"P1.E1_MISMATCH_ROLE","detail":"expected exactly one e1-mismatch-bundle artifact; found 1","passed":true},{"code":"P1.E1_MANIFEST_ROLE","detail":"expected exactly one e1-artifact-manifest artifact; found 1","passed":true},{"code":"P1.FIXTURE_ROLE","detail":"expected exactly one fixture-agreement artifact; found 1","passed":true},{"code":"P1.FIXTURE_DEFINITION_ROLE","detail":"expected exactly one fixture-definition-set artifact; found 1","passed":true},{"code":"P1.FIXTURE_LRCALC_ROLE","detail":"expected exactly one fixture-evaluator-lrcalc artifact; found 1","passed":true},{"code":"P1.FIXTURE_NORMALIZ_ROLE","detail":"expected exactly one fixture-evaluator-normaliz artifact; found 1","passed":true},{"code":"P1.E2_SUMMARY_ROLE","detail":"expected exactly one e2-fixture-summary artifact; found 1","passed":true},{"code":"P1.E2_SIDECAR_ROLE","detail":"expected exactly one e2-summary-sidecar artifact; found 1","passed":true},{"code":"P1.BASELINE_HASH","detail":"expected b345773c40f2c340808ec20c424b1d33cba59e68bf45796842f1550d742b42d7; computed b345773c40f2c340808ec20c424b1d33cba59e68bf45796842f1550d742b42d7","passed":true},{"code":"P1.BASELINE_COUNT","detail":"expected 7549 triples; found 7549","passed":true},{"code":"P1.BASELINE_SCOPE","detail":"expected scope {'max_length': 5, 'max_size': 7}; found {'max_length': 5, 'max_size': 7}","passed":true},{"code":"P1.BASELINE_CANONICALIZER","detail":"canonicalization must contain 'swap-only'; found 'order-2 swap-only (the only symmetry that preserves the stretched polynomial); conjugation is NOT a valid P-symmetry'","passed":true},{"code":"P1.E1_PARITY_REPORT","detail":"typed E1 report proves exact parity against pinned expectation","passed":true},{"code":"P1.E1_FRONTIER_PAYLOAD","detail":"controller directly hashed the production E1 frontier payload","passed":true},{"code":"P1.E1_MISMATCH_BUNDLE","detail":"E1 mismatch bundle is typed and empty","passed":true},{"code":"P1.E1_ARTIFACT_LINKAGE","detail":"E1 report and mismatch bytes are bound through both manifests","passed":true},{"code":"P1.FIXTURE_LRCALC_ARTIFACT","detail":"typed lrcalc-interp fixture artifact is internally consistent","passed":true},{"code":"P1.FIXTURE_NORMALIZ_ARTIFACT","detail":"typed normaliz-ehrhart fixture artifact is internally consistent","passed":true},{"code":"P1.FIXTURE_EVALUATOR_ID_SET","detail":"typed evaluator artifacts cover the same nonempty fixture-id set","passed":true},{"code":"P1.E2_SUMMARY","detail":"E2 all-pass summary, sidecar, report ledger, adapters, and tool versions are linked","passed":true},{"code":"P1.FIXTURE_EVIDENCE_CHAIN","detail":"policy-pinned definitions, reports, hive inputs, raw outputs, and adapters are linked","passed":true},{"code":"P1.FIXTURE_SCHEMA","detail":"fixture schema is 'lr-p1-fixture-agreement/v1'","passed":true},{"code":"P1.FIXTURE_COUNT","detail":"found 6 fixtures; minimum is 6","passed":true},{"code":"P1.FIXTURE_TOPLEVEL_AGREEMENT","detail":"all_agree is True","passed":true},{"code":"P1.FIXTURE_RECORDS","detail":"all fixture records are exact and independently manifested","passed":true},{"code":"P1.FIXTURE_COVERAGE","detail":"all required fixture coverage tags present","passed":true},{"code":"P1.FIXTURE_ADAPTER_ID_SET","detail":"agreement adapter and both typed evaluators cover exactly the same fixtures","passed":true}],"evidence_manifest_sha256":"f4c65f7a4a71f4037d8b55f788f1c51524d31193de91e377ed8d2d2acac37afb","failures":[],"gate_id":"P1","next_action":"integrator may adjudicate P1_ORACLE_VALIDATED; this report does not transition state","passed":true,"policy_sha256":"2c64589e633cc06f82721813846d56a055a97e89a00d1792b40d569419b2c3a5","schema_version":"lr-p1-gate-report/v1"}
